<?xml version="1.0" encoding="UTF-8" standalone="yes"?>

<polls xmlns="http://www.uts.edu.au/31284/wsd-diary"
 xmlns:xsi="http://www.w3.org/2001/XMLSchema-instance"
 xsi:schemaLocation="http://www.uts.edu.au/31284/wsd-diary polls.xsd">
    <poll id="0">
        <title>Poll Title</title>
        <creator>john.rahme.se@gmail.com</creator>
        <description>Poll Desciption</description>
        <location>Poll Location</location>
        <createdAt>
            <date>12/04/2016</date>
            <time>22:30</time>
        </createdAt>
        <open>true</open>
        <options>
            <option>
                <id>0</id>
                <timeslot>
                    <date>12/04/2016</date>
                    <time>22:30</time>
                </timeslot>
                <participants>
                    <participant>
                        <name>Richard</name>
                        <available>true</available>
                    </participant>
                    <participant>
                        <name>James</name>
                        <available>false</available>
                    </participant>
                </participants>
            </option>
            <option>
                <id>1</id>
                <timeslot>
                    <date>13/04/2016</date>
                    <time>22:34</time>
                </timeslot>
                <participants>
                    <participant>
                        <name>Richard</name>
                        <available>true</available>
                    </participant>
                    <participant>
                        <name>James</name>
                        <available>false</available>
                    </participant>
                </participants>
            </option>
        </options>
    </poll>
    <poll id="1">
        <title>Poll Title2</title>
        <creator>test@test.se</creator>
        <description>Poll Desciption2</description>
        <location>Poll Location2</location>
        <createdAt>
            <date>12/04/2016</date>
            <time>22:30</time>
        </createdAt>
        <open>true</open>
        <options>
            <option>
                <id>0</id>
                <timeslot>
                    <date>12/04/2016</date>
                    <time>22:30</time>
                </timeslot>
                <participants>
                    <participant>
                        <name>Richard</name>
                        <available>true</available>
                    </participant>
                    <participant>
                        <name>James</name>
                        <available>false</available>
                    </participant>
                </participants>
            </option>
            <option>
                <id>1</id>
                <timeslot>
                    <date>13/04/2016</date>
                    <time>22:34</time>
                </timeslot>
                <participants>
                    <participant>
                        <name>Richard</name>
                        <available>true</available>
                    </participant>
                    <participant>
                        <name>James</name>
                        <available>false</available>
                    </participant>
                </participants>
            </option>
        </options>
    </poll>
</polls>
